trait,total_occurrence,unique_occurrence,uri,definition,comment
visit flowers of,21,2,http://purl.obolibrary.org/obo/RO_0002622,"",""
propagule,21,14,http://eol.org/schema/terms/Propagule,The dispersal unit for sexual regeneration.,""
fruit type,21,14,http://purl.obolibrary.org/obo/TO_0000850,A fruit anatomy and morphology trait (TO:0002629) which is associated with the type of a fruit (PO:0009001). ,""
leaf shape,16,12,http://purl.obolibrary.org/obo/TO_0000492,A leaf anatomy and morphology trait (TO:0000748) which is associated with the variation in shapes and forms of a leaf (PO:0025034). ,""
leaf size class,11,9,http://purl.obolibrary.org/obo/FLOPO_0003958,"",""
bud source,9,3,http://eol.org/schema/terms/BudSource,Location of bud bank for resprouting. ,""
age at maturity,9,6,http://eol.org/schema/terms/AgeAtMaturity,Age at the first successful reproduction.,""
reproduction,9,9,http://purl.obolibrary.org/obo/GO_0000003,The production of new individuals that contain some portion of genetic material inherited from one or more parent organisms,""
ecomorphological guild,8,5,http://eol.org/schema/terms/EcomorphologicalGuild,organisms that share certain morphological traits due to adaptation to similar environments and ecological roles,""
motility,6,6,http://www.wikidata.org/entity/Q33596,"ability to move spontaneously and actively, consuming energy in the process",""
extinction status,6,6,http://eol.org/schema/terms/ExtinctionStatus,Indicates whether a taxon is extant (living today) or extinct.,""
first appearance,6,3,http://eol.org/schema/terms/FossilFirst,The first appearance of this taxon in the fossil record.,""
last appearance,6,3,http://eol.org/schema/terms/FossilLast,The last appearance of this taxon in the fossil record.,""
seed bank,5,5,http://eol.org/schema/terms/SeedBank,Location of persistent seed bank (longevity > 1 yr).,""
are pathogens of,5,3,http://purl.obolibrary.org/obo/RO_0002556,"",""
produces,4,4,http://purl.obolibrary.org/obo/RO_0003000,"This organism produces this material or substance, either during its life or after death. A produces B if some process that occurs in A has output B.",""
are mutualistic with,4,1,http://purl.obolibrary.org/obo/RO_0002442,An interaction relationship between two organisms living together in more or less intimate association in a relationship in which both organisms benefit from each other,""
number of fossil occurrences,3,3,http://eol.org/schema/terms/fossilOccPBDB,The number of fossil occurrences in the Paleobiology Database (https://paleobiodb.org) that are identified as belonging to a particular taxon or any of its subtaxa.,""
prey on,3,1,http://purl.obolibrary.org/obo/RO_0002439,"An interaction relationship involving a predation process, where the subject kills the target in order to eat it or to feed to siblings, offspring or group members",""
resprout ability after disturbance,2,2,http://eol.org/schema/terms/RespDist,Resprouting ability after an undefined disturbance that removed most of the aboveground biomass.,""
toxic effect,2,2,http://eol.org/schema/terms/ToxicEffect,A toxic effect has been observed in other organisms after consuming or contacting this organism,""
visit,2,1,http://purl.obolibrary.org/obo/RO_0002618,"",""
water body,1,1,http://rs.tdwg.org/dwc/terms/waterBody,The name of the water body in which the location occurs,""
skeletal reinforcement,1,1,http://eol.org/schema/terms/SkeletalReinforcement,"The nature of structural reinforcements of shells, leaves, scutes, or carapaces. Smooth shells and carapaces lack reinforcements.",""
nitrogen fixation,1,1,http://purl.obolibrary.org/obo/GO_0009399,"The process in which nitrogen is taken from its relatively inert molecular form (N2) in the atmosphere and converted into nitrogen compounds useful for other chemical processes, such as ammonia, nitrate and nitrogen dioxide. ",""
are symbionts of,1,1,http://purl.obolibrary.org/obo/RO_0002440,The smaller partner living in close association with,""
trophic level,1,1,http://www.wikidata.org/entity/Q1053008,"position of an organism in a food web. May be described verbally with descriptors including primary producer, herbivore or carnivore. If described numerically, 1 indicates a primary producer, 2 a herbivore, and so on up the food web.",""
locomotion,1,1,http://purl.obolibrary.org/obo/GO_0040011,Self-propelled movement of a cell or organism from one location to another. ,""
eat,1,1,http://purl.obolibrary.org/obo/RO_0002470,"",""
